ID	audio	tgt_text
460	5152804099019194563.wav	С 1988 года избирательные ящики должны быть прозрачными, чтобы избиратели и наблюдатели могли увидеть, что в начале голосования в них нет конвертов, и что конверты добавляются только от правильно подсчитанных и уполномоченных избирателей.
461	5153770112137332001.wav	Хьюн ушел в отставку, и его заместителем в кабинете станет депутат Эд Дейви. Предполагается, что депутат Норман Лэмб займет вакантное место Министра по делам предприятий, которое освободит Дейви.
462	5164710956485163027.wav	Между 22:00 и 23:00 по МДТ заключенные подожгли пожар на улице.
463	517532078886085321.wav	Адекватное использование блогов может помочь студентам стать более аналитическими и критическими; через активное откликание на интернет-материалы студенты могут определить свою позицию в контексте других текстов, а также изложить свои собственные точки зрения на конкретные вопросы (Оравец, 2002).
464	5196260640941390313.wav	Но находясь в «высоких тропиках» всего лишь на несколько градусов к северу от экватора, вам придется иметь дело и с жарой (всегда) и с ярким солнцем (когда небо ясное, более редко).
465	5198402243598272340.wav	Это также может оказаться полезным приобрести Wild Card, который дает право посещения либо выбранных парков в Южной Африке, либо всех Национальных парков Южной Африки.
466	5204109021824689215.wav	Поиск в интернете по запросу курс по созданию враждебной среды вероятно предоставит адрес местной компании.
467	5220085499631368243.wav	Виртуальные команды придерживаются тех же стандартов качества, что и традиционные команды, но есть тонкие различия.
468	5358875111503056320.wav	По мере угасания знания греческого языка Запад оказался отрезанным от своих греческих философских и научных корней.
469	5381110210154713971.wav	Изначально его госпитализировали в Хосписе Джеймса Пэджета в Грейт-Ярмуте.
470	5381693779708341332.wav	Столица Молдовы - Кишинев. Местный язык - румынский, но широко используется русский.
471	5407053594615190090.wav	Древний Китай имел уникальный способ показа различных периодов времени; каждая эпоха или каждая правящая семья в Китае представляла собой отдельную династию.
472	5408022991504111502.wav	Сильные ветры, град, чрезмерные осадки и лесные пожары являются формами и последствиями суровой погоды, как и грозы, торнадо, водяные смерчи и циклоны.
473	5433314566767233828.wav	После произошедшего инцидента Гибсон был доставлен в больницу, но вскоре скончался.
474	546231163869746473.wav	Будьте осторожны, чтобы ткань не нагрелась слишком сильно (что может вызвать ее сжатие или в экстремальных случаях – ожог).
475	5482406888941085018.wav	Он изначально был госпитализирован в больнице Джеймса Пейджета в Грейт-Ярмуте.
476	5505398583576174352.wav	Перри заявил, что он возвратится в Техас, чтобы оценить результаты сегодняшнего каукса, определить, есть ли путь вперед для меня в этом забеге, но позже заявил, что останется в гонке и будет участвовать в первичных выборах в Южной Каролине 21 января.
477	5524098527613997160.wav	Использование видеозаписи привело к важным открытиям в интерпретации микровыражений, лицевых движений, продолжительностью всего несколько миллисекунд.
478	5531306493601107261.wav	Их дисциплинированная защита, навыки владения мячом и отличная командная работа выделили их, и было ясно, что это была команда, которую нужно побить.
479	5536399024273287176.wav	Интернет сочетает элементы как массового, так и межличностного общения.
480	559615000143317446.wav	Во-первых, большинство наездников носят сапоги с каблуком и плавной, довольно узкой подошвой.
481	5606750157981126233.wav	В самом начале своего существования передача была показана исключительно на долго существующем интернет-радио TogiNet Radio, специализирующемся на ток-радио.
482	5657427923960079748.wav	Некоторые люди считали, что он был прав, но многие верили в противоположное: что Солнечная система двигается вокруг Земли, включая Солнце (и даже другие звезды).
483	5767934843388875369.wav	При переходе через Северное Прибалтийское море зимой убедитесь в расположении каюты, так как прохождение через лед создает довольно ужасный шум для наиболее пострадавших.
484	5865390219641610051.wav	Корпус инженеров США оценил, что 6 дюймов осадков могут нарушить ранее поврежденные дамбы.
485	5866078581108668966.wav	Итак, вероятно, что обозначение было добавлено просто как метка.
486	5904418145588789259.wav	Конгресс начал выделение средств на инициативу по борьбе с неангельскими изделиями в фискальном 2005 году и указал, что ФБР должно направить 10 агентов на порнографию для взрослых.
487	5907599423488165658.wav	Остров Гонконг дает название территории Гонконг и является местом, которое многие туристы считают основным центром внимания.
488	5910253289107526048.wav	В конечном итоге, не следует удивляться, если наши собственные предки решали свою белковую проблему примерно таким же образом, как это делают шимпанзе на саванне сегодня.
489	5920564818407981934.wav	Как Луна оказывает тяготеющее воздействие на Землю, вызывая приливы, так же и Млечный Путь оказывает силу на галактику Стрельца.
490	5922110980503615373.wav	Не портите место, делая зарисовки или царапая граффити на сооружениях.
491	5966925948005244453.wav	Фотографы затем заняли место пожилой женщины, так как ей понадобилось в туалет. Мендоса был застрелен.
492	5970882371928079940.wav	Мадагаскар является вне всякого сомнения самым крупным и уникальным континентом по богатству фауны.
493	6057938296244834632.wav	Документ, по слухам, будет касаться спора о границах, который Палестина хочет основывать на границах до арабо-израильской войны 1967 года.
494	6075416811919407935.wav	Из-за подводной топологии обратный поток сосредотачивается в нескольких участках с более глубокими участками, и там может образоваться быстрый течущий поток к глубокой воде.
495	6080082056978846750.wav	Спутник был отправлен в космос ракетой. Ученые используют телескопы в космосе, потому что атмосфера Земли искажает часть нашего света и видения.
496	6162405598905036396.wav	Сильный ветер, град, избыточные осадки и лесные пожары - это формы и последствия суровой погоды, как и грозы, торнадо, водяные смерчи и циклоны.
497	6203495122297129260.wav	Этот осадок был необходим для создания отмели и пляжей, которые служили местами обитания дикой природы.
498	621925716775998155.wav	Исследования двадцатого века показали, что существуют два пула генетического вариабельности: скрытый и проявленный.
499	6243143230365031162.wav	В результате актеры курят марихуану на сцене, и сам театр поощряет зрителей присоединиться.
500	6263891810431071444.wav	Их тепловое поведение не настолько стабильно, как у больших пещер на Земле, которые часто поддерживают достаточно постоянную температуру, но оно согласуется с тем, что это глубокие ямы в земле, - сказал Глен Кушинг из Астрогеологической команды Геологической службы США (USGS) и Северо-Аризонского университета, расположенного во Флагстаффе, Аризона.
501	6269047638238623389.wav	Федерация гимнастики США поддерживает позицию Национального олимпийского комитета Соединенных Штатов и признает необходимость создания безопасной среды для всех наших спортсменов в семье Олимпиады.
502	6275116524641817120.wav	Ангел (2006) объясняет подход Континуума как метод, используемый для помощи организациям достичь более высокого уровня производительности.
503	6284223441572848962.wav	Мартелли вчера присягнул на новый временный избирательный совет (CEP) из девяти членов.
504	6306322369645218273.wav	Можно только гадать, каким станет клавиатура, когда появится что-то новое.
505	6351367445025505944.wav	Львы - самые общительные кошки, живущие в больших группах, называемых стаи.
506	6354316372780583820.wav	Хотя искусственный интеллект имеет сильную ассоциацию с научной фантастикой, он является очень важным направлением в компьютерной науке, занимающимся поведением, обучением и интеллектуальной адаптацией в машине.
507	6434859821714227491.wav	Любой, кто собирается ехать в высокие широты или через горные перевалы, должен учитывать возможность снега, льда или морозных температур.
508	6441357835378888974.wav	На самом деле, его не так легко найти, даже если бы кто-то знал, что он существует. Попав в пещеру, ты совершенно изолирован.
509	6507390080013738113.wav	Лейтон попросил внести изменения в экологический законопроект консерваторов во время встречи с премьер-министром, запросив тщательное и полное переписывание экологического законопроекта консервативной партии.
510	6603783905885843777.wav	Долина Кочамо - первоклассное место для скалолазания в Чили, известное как Йосемити Южной Америки, с разнообразием гранитных больших стен и утесов.
511	6605272483833286221.wav	Шок реинтеграции наступает раньше, чем культурный шок (нет такого длительного первоначального периода), длится дольше и может быть более сильным.
512	6614658234069371088.wav	Мост должен быть полностью введен в эксплуатацию в сентябре 2017 года, когда ожидается завершение пунктов таможенного контроля Бразилии.
513	6620311002113327699.wav	Количество присутствующих было настолько велико, что не у всех хватило места на похоронах на площади Святого Петра.
514	6620866315580544260.wav	Некоторые атомы имеют нестабильные ядра, что означает, что они склонны распадаться с минимальным или без воздействия.
515	6656552880161745727.wav	На севере регион ограничен Сахелью, а на юге и западе — Атлантическим океаном.
516	6701991686450020774.wav	Корреляция между патологией мозга и поведением поддерживает ученых в их исследованиях.
517	6745531990699497785.wav	Он был затем переведен в больницу Адденбрука в Кембридже.
518	6774385073956642067.wav	Но находясь в «высоких тропиках» всего лишь на несколько градусов к северу от экватора, вам придется иметь дело как с жарой (всегда), так и с ярким солнцем (когда небо ясно, что бывает реже).
519	678174152690230753.wav	Это связано, но обычно не включает альпийский стиль катания на лыжах или альпинизм, последний надо делать на крутых склонах и требует более жестких лыж и ботинок.
520	6810123023171733450.wav	Мадагаскар - крупнейший континент, когда речь идет о дикой природе.
521	6817878979697223927.wav	Все существительные, наряду с словом Sie для вас, всегда начинаются с заглавной буквы, даже посреди предложения.
522	6824515440136565318.wav	Школьные экскурсии являются важной частью каждого класса. Очень часто учитель хотел бы взять своих учеников в места, куда поездка на автобусе не вариант.
523	68300966899801601.wav	С другой стороны, ледяные и снежные условия являются нормой во многих странах, и движение на дорогах в основном не прерывается круглый год.
524	6845248534284654.wav	Регулярные объявления в метро делаются только на каталанском, но не запланированные нарушения объявляются автоматической системой на различных языках, включая испанский, английский, французский, арабский и японский.
525	6847551837519900288.wav	Финляндия - отличное место для катания на лодке. Страна тысячи озёр также имеет тысячи островов, как в озерах, так и на береговых архипелагах.
526	6852813781354643345.wav	Его длинные челюсти были усыпаны более чем 70 бритвенно-острыми зубами, а также дополнительным рядом на небе его рта, что означало, что не было спасения для чего-либо, пересекающего его путь.
527	6873447881355850328.wav	Поверхность Луны состоит из камней и пыли. Внешний слой Луны называется корой.
528	6909856093066898902.wav	В 2002 году Гома была разрушена лавой вулкана Нирагонго, которая засыпала большую часть улиц города, особенно его центр.
529	6915474618514234246.wav	Он также нападал на все, что входило в воду; даже гигантский динозавр, подобный Тираннозаврусу рексу, не смог бы с ним справиться.
530	6917907748364342404.wav	Он не установил цифру для сокращений, говоря, что они будут основаны на экономическом производстве Китая.
531	6923678949967639873.wav	Слово цивилизация происходит от латинского civilis, что означает гражданский, связано с латинским civis, что означает гражданин, и civitas, что означает город или городское государство, и также как-то определяет размер общества.
532	6927296460002744628.wav	Растения выглядят наилучшим образом, когда находятся в естественной среде, поэтому удержитесь от искушения удалить хотя бы просто один экземпляр.
533	6933250279887426793.wav	Центром тибетской медитации является Дейтя Йога. Через визуализацию различных божеств очищаются энергетические каналы, активизируются чакры и создается осознание просветления.
534	6959849979442158896.wav	Он, по сообщениям, был в возрасте около 20 лет. В заявлении Бибера говорится: [х]отя я не присутствовал и не был непосредственно связан с этой трагической аварией, мои мысли и молитвы с семьей жертвы.
535	7053482366261158.wav	Хотя искусственный интеллект имеет сильную ассоциацию со научной фантастикой, ИИ представляет собой очень важное направление в информатике, занимающееся поведением, обучением и интеллектуальной адаптацией в машине.
536	7147508536410384136.wav	Древние культуры и племена начали их содержать для удобного доступа к молоку, шерсти, мясу и шкурам.
537	7199696972196091849.wav	Он также занимался гравировкой банкнот для многих стран, недавние примеры его работы включают портреты премьер-министров на лицевой стороне новых канадских купюр номиналом в 5 и 100 долларов.
538	7205372698028731729.wav	Парижане имеют репутацию эгоцентричных, грубых и высокомерных.
539	7213249863906599090.wav	Его известность как эпицентра роскоши началась примерно в 400 году нашей эры и продолжалась до примерно 1100 года нашей эры. 
540	7233685891059653046.wav	Шенгенская зона, однако, работает в этом отношении как одна страна.
541	7237307653762156914.wav	Однако процент случаев множественно-лекарственно-устойчивой туберкулеза в общей группе людей, страдающих туберкулезом, всё ещё кажется невысоким; 6 000 из общего числа 330 000 людей, инфицированных в данный момент в Южной Африке.
542	7266355212113564962.wav	Это место, которое британские колонизаторы взяли в своё владение, поэтому если вы ищете доказательства колониального прошлого территории, здесь хорошее место, чтобы начать.
543	727761988624859269.wav	Аристотель, философ, теоретизировал, что все состоит из смеси одного или нескольких из четырех элементов. Это были земля, вода, воздух и огонь.
544	7301728842091889171.wav	Службой часто пользуются компании судоходства, включая яхтенные суда, а также экспедиции, имеющие потребности в удаленном доступе к данным и голосу.
545	7355420232561873190.wav	Путешественникам настоятельно рекомендуется быть в курсе любых угроз серьезной погоды в их районе, так как это может повлиять на любые планы поездки.
546	7366992441583559574.wav	Древний Китай имел уникальный способ показывать различные исторические периоды; каждый этап развития Китая или каждая правящая династия была характерной.
547	7378068468742958430.wav	На ближней стороне может быть больше морей, потому что кора тоньше. Лаве было легче подниматься на поверхность.
548	7378917572989533960.wav	Сплавы в основном представляют собой смесь двух или более металлов. Не забывайте, что на периодической таблице есть много элементов.
549	7411546787616977704.wav	Опора (scaffolding) - это не метод обучения, а скорее средство, которое обеспечивает поддержку людям, проходящим новый учебный опыт, такой как использование новой компьютерной программы или начало нового проекта.
