ID	audio	tgt_text
369	3005219570158977238.wav	Спутник был запущен в космос ракетой. Учёные используют телескопы в космосе, потому что атмосфера Земли искажает некоторое из нашего света и видения.
370	3039867296204116367.wav	Задачей флотов традиционно является обеспечение возможности вашей страны перемещать своих людей и товары, а также помехи в возможности вашего врага перемещать своих людей и товары.
371	3083929122891715513.wav	Оттава - очаровательная двуязычная столица Канады, здесь множество художественных галерей и музеев, демонстрирующих прошлое и настоящее Канады.
372	3100569628927735189.wav	Гренландия была поселена редко. В норвежских сагах рассказывается, что Эйрик Красный был изгнан из Исландии за убийство и, отправившись дальше на запад, обнаружил Гренландию и назвал её Гренландией.
373	3111983050474671345.wav	Круизы в Санкт-Петербург включают время в городе. Пассажиры круизов освобождены от требований визы (проверьте условия).
374	3130624662424273953.wav	За всего две недели американские и французские силы свободы освободили южную Францию и направлялись к Германии.
375	3156459702070203007.wav	Долина Кочамо - ведущее в Чили место для скалолазания, известное как Йосемити Южной Америки, с разнообразием гранитных больших стен и выступов.
376	315766676094600296.wav	Женщинам: Рекомендуется, чтобы все женщины-путешественницы заявляли о своем браке, независимо от фактического семейного положения.
377	3160468870562283269.wav	На прошлой неделе METI объявило, что Apple сообщила о 34 дополнительных случаях перегрева, которые компания назвала не серьезными.
378	319499985577636973.wav	Наконец, существует много маленьких кошек (включая бездомных домашних кошек), которые питаются гораздо более численными мелкими добычами, такими как насекомые, грызуны, ящерицы и птицы.
379	3195362600486929544.wav	Центром тибетской медитации является Дэити-йога. Через визуализацию различных божеств очищаются энергетические каналы, активируются чакры и создается сознание просветления.
380	3208417939957005389.wav	Конечно, существуют христианские теологические объяснения этой традиции, но это может быть и языческий весенний и ритуал плодородия.
381	3236057319333367673.wav	Как и во всех национальных парках Южной Африки, в парке взимаются ежедневные платы за сохранение и вход.
382	3296442401947230785.wav	Это предоставляет отличную возможность увидеть северное сияние, поскольку небо будет практически круглосуточно темным.
383	3306779845046917300.wav	Дель Потро имел преимущество в начале второго сета, но и этот сет также потребовал тай-брейка после достижения счета 6-6.
384	3337787499768294195.wav	Будьте осторожны, чтобы ткань не нагрелась слишком сильно (что может вызвать ее усадку или, в экстремальных случаях, обугливание).
385	3359859709812172802.wav	Они обычно предлагают специальные предложения по еде, напиткам и развлечениям, чтобы поддерживать гостей в хорошем настроении и удерживать их на территории.
386	3362263413020550013.wav	В частности, утверждается, что можно определить, лжет ли человек, правильно интерпретируя микро-выражения.
387	3364947814969998944.wav	Документ, согласно утечке, будет касаться граничного спора, о котором Палестина хочет сослаться на границы до первой арабо-израильской войны 1967 года.
388	3401231636665586110.wav	С момента основания Асунсьона в 1537 году Парагвай смог сохранить значительную часть своего коренного характера и идентичности.
389	3404855403082339212.wav	Можно только гадать, чем станет клавиатура, когда появится что-то новое.
390	3474684838723877021.wav	Маститые ударники, Сачин Тендулкар и Рахул Дравид, хорошо сыграли и установили партнерство на сто забегов.
391	3491234462595391279.wav	Мы не знаем точно, но, возможно, у него был расщепленный язык. В его рацион входили черепахи, крупные рыбы, другие мозазавры, и даже он сам мог быть плотоядным.
392	3495437884024744716.wav	Растения выглядят наилучшим образом в естественной среде, поэтому сопротивляйтесь искушению удалить даже всего один образец.
393	3502277023574363012.wav	Стаи состоят из одного-трёх взрослых самцов и до тридцати самок и детёнышей.
394	3529855487992513201.wav	Это кажется разумным, ведь Земля не чувствуется как движущаяся, верно?
395	3560085468216752165.wav	Поскольку загрязнение светом в их расцвет не было проблемой, как сегодня, они обычно находятся в городах или на кампусах, доступных для путешествий, чем те, что строятся в наше время.
396	3562415917464695718.wav	Чем меньше число Россби, тем менее активна звезда относительно магнитных инверсий.
397	3585583328394597156.wav	Его длинные челюсти были усажены более чем 70 бритвенно острыми зубами, а также дополнительным комплектом на верхнем небе, что означало, что для чего-либо, пересекшего его путь, не было спасения.
398	3611463628224454693.wav	Ничего не видно, кроме ясного, красивого неба над головой и множества окружающих гор. Из пещеры почти не видно и не слышно ничего этого мира.
399	3664511950771966320.wav	Присутствие настоящей невидимой команды (Ларсон и Лафасто, 1989, стр. 109) также является уникальным компонентом виртуальной команды.
400	3702958695101050591.wav	Принимались во внимание взгляды Аристотеля по всем вопросам науки, включая психологию.
401	3709475786289139797.wav	Во многих других городах Италии и в остальном мире, особенно в Польше, были созданы аналогичные установки, которые были просмотрены большим количеством людей.
402	3745044899208519847.wav	25 плакатов Данлап, до сих пор известных, являются самыми древними сохранившимися копиями данного документа. Оригинальная рукописная копия не сохранилась.
403	3793212987221322581.wav	На отдаленных островах, возможно, кредитные карты не будут приниматься, хотя британская и американская валюта могут быть приняты; свяжитесь с владельцами заранее, чтобы узнать, какой метод оплаты является приемлемым.
404	3794657101809943148.wav	Чтобы увидеть лучшие виды Гонконга, покиньте остров и направляйтесь к набережной Коулуна напротив.
405	3795099655869307739.wav	К концу Средних веков западная Европа начала развивать собственный стиль. Одним из крупнейших достижений времени стало то, что после крестовых походов люди начали использовать пуговицы для застегивания одежды.
406	3797667971540248320.wav	Поскольку перья динозавров не имеют хорошо развитого черевика, называемого ракисом, но имеют другие характеристики перьев — бородки и бородки — исследователи предположили, что ракис, вероятно, был более поздним эволюционным развитием по сравнению с этими другими характеристиками.
407	384435163157965470.wav	В то время как он работал в больнице, Лиггинс начал заниматься исследованием преждевременных родов в свободное время.
408	3866409166763965048.wav	Правящая партия Народная организация Юго-Западной Африки (SWAPO) также сохраняла большинство на парламентских выборах.
409	3922043533653727350.wav	На самом деле, его не так просто найти, даже если кто-то знает, что оно существует. Оказавшись внутри пещеры, ты окажешься в полной изоляции.
410	3926276660303924456.wav	Будьте тверды в отказе мужчинам и не бойтесь отстаивать свою позицию (культурные различия не оправдание).
411	3927163358777802368.wav	Исследователи из Принстонского университета в США и Уппсальского университета в Швеции сообщили, что новый вид эволюционировал всего за два поколения, хотя считалось, что этот процесс должен занять гораздо больше времени из-за скрещивания между эндемичным дарвиновским вьюрком Geospiza fortis и иммигрантским кактусовым вьюрком Geospiza conirostris.
412	394135166243682296.wav	ASUS Eee PC, ранее запущенный по всему миру с учетом экономических и функциональных факторов, стал горячей темой на Тайпейском IT-месяце 2007 года.
413	3945532745541195136.wav	На другом конце спектра человек превращается в неразличимую личность, которая чувствует, что должна изменить все, что делала команда, и сделать это своим.
414	3986128848664857815.wav	Если вы выходите на берег только посредством экскурсий с судна, вам не понадобится дополнительная виза (на 2009 год).
415	3996353344156412065.wav	Мы строим наши дома из растений и делаем одежду из растений. Большинство продуктов, которые мы едим, - это растения. Без растений животные не могли бы выжить.
416	4027984920362132391.wav	Сундарбанс был объявлен памятником Всемирного наследия ЮНЕСКО. Часть леса на территории Индии называется национальным парком Сундарбанс.
417	4041283782469778574.wav	Проведенная работа была в основном теоретической, но программа была написана для имитации наблюдений, сделанных за галактикой Стрельца.
418	4060670580459188209.wav	РС - это болезнь, которая поражает центральную нервную систему, состоящую из мозга, спинного мозга и зрительного нерва.
419	4103166808026076685.wav	Он добавил, что они не должны, однако, просятся браться за обязательства, выходящие за рамки их уровня развития, ответственности и возможностей.
420	4130846879604713113.wav	Почти все они представляют собой песчаные пляжи с безопасным купанием, и большинство из них имеют тень, создаваемую деревьями полутукава.
421	4168260504174612795.wav	Во многих других городах Италии и в остальном мире, особенно в Польше, были созданы аналогичные установки, которые были просмотрены большим числом людей.
422	4171508807010088989.wav	Ионы водорода - это протоны, у которых были отобраны электроны (поскольку атомы водорода состоят из одного протона и одного электрона).
423	4186976662250569146.wav	Столица Молдовы - Кишинев. Местным языком является румынский, но широко используется русский.
424	4257743601527484794.wav	Однако слушайтесь советов авторитетов, следуйте всем указаниям и обращайте внимание на предупреждения о безопасности.
425	4312337355143990691.wav	Некоторые атомы имеют нестабильные ядра, что означает, что они склонны распадаться с минимальными усилиями или даже без них.
426	4329375098749636027.wav	Большинство зданий на краю комплекса были реконструированы для того, чтобы дать туристам лучшее представление о том, как они изначально выглядели.
427	4332544138278608734.wav	Это важный способ различить между некоторыми глаголами и объектами.
428	4439398069046383836.wav	Лакха Сингх также представил баджан чхаппан бхог. Его сопровождал певец Раджу Кхандельвал.
429	4446007980468141561.wav	Хотя это часто является только неточным стереотипом, лучший способ ладить в Париже — вести себя правильно, как человек биен элеве (воспитанный). Это значительно упростит передвижение.
430	4491697341889976683.wav	Если вы не привыкли к езде по сельским дорогам, будьте начеку: крутые подъемы, узкие полосы и острые повороты преобладают.
431	4496786334735634498.wav	Апиа - столица Самоа. Город находится на острове Уполу и население составляет немного менее 40 000 человек.
432	4498640649175127270.wav	Он, по сообщениям, был возрастом около 20 лет. В заявлении Бибер сказал: [х]отя я не был присутствовал и не был непосредственно связан с этим трагическим происшествием, мои мысли и молитвы семье жертвы.
433	4498797456222901763.wav	Четыре лыжницы из группы спортсменок в сидячем дивизионе не смогли закончить свои спуски, а 45 из 117 общего числа лыжников в гигантском слаломе не смогли занять место в гонке.
434	4507570726474155114.wav	Нет универсального определения, какие произведения промышленности являются антиквариатом. Некоторые налоговые учреждения определяют товары старше 100 лет как антиквариат.
435	4562231445388891346.wav	NextGen - это система, которая, по заявлению Федерального управления гражданской авиации, позволит самолетам летать по более коротким маршрутам и экономить миллионы галлонов топлива ежегодно, а также снизит выбросы углерода.
436	4566051537148836720.wav	Поздно в воскресенье президент Соединенных Штатов Дональд Трамп заявил через пресс-секретаря, что американские войска покидают Сирию.
437	4638707534646618403.wav	Объявление было сделано после того, как Трамп провел телефонный разговор с президентом Турции Реджепом Тайипом Эрдоганом.
438	4666717028619624057.wav	Это утверждает, что наиболее эффективным местом для основного объекта является пересечение линий, разделяющих изображение на трети по вертикали и горизонтали (см. пример).
439	4690800207484418897.wav	Вертикальный просвет под мостом составляет 15 метров. Строительство было завершено в августе 2011 года, но открылся для движения только в марте 2017 года.
440	4705502721902980056.wav	Подумайте о маршруте катания на лыжах, как о похожем на пеший маршрут.
441	4727095276781970486.wav	Люди могут не предполагать, что терпение и понимание также необходимы для путешественников, возвращающихся домой.
442	4780196329895653733.wav	Глажка влажной одежды может помочь им высохнуть. Во многих отелях есть утюг и гладильная доска, доступные для проката, даже если их нет в номере.
443	4807942348083346744.wav	На ближней стороне может быть больше морей из-за того, что кора тоньше. Лаве было легче подниматься на поверхность.
444	4821372520807131.wav	Глажка влажной одежды может помочь им высохнуть. Во многих отелях есть утюг и гладильная доска, которые можно взять напрокат, даже если их нет в номере.
445	4822858934027125258.wav	Это не только одиночное исследование, эксперимент, и эксперимент - это тест, который используется для опровержения одной или нескольких возможных гипотез, задавая вопросы и делая наблюдения также направляют научные исследования.
446	4838660681321542582.wav	В теплом климате Ближнего Востока дом не был так важен.
447	4844570914389909899.wav	До прибытия войск Гаити не сталкивалась с проблемами, связанными с болезнью, с 1800 года.
448	4848767269319106744.wav	Карри - это блюдо, основанное на травах и специях, вместе с мясом или овощами.
449	4872682023567074953.wav	Два соединения реагируют друг с другом, образуя кристаллы, которые могут заблокировать функцию почек, сообщили исследователи университета.
450	4911753908854223816.wav	С 1966 года Сундарбан признан заповедником, и предполагается, что в этой зоне сейчас обитает около 400 королевских бенгальских тигров и около 30 000 ланей.
451	4937589470390171572.wav	Aerosmith отменили свои оставшиеся концерты в рамках тура.
452	4940213511640275250.wav	Итальянский является также повседневным языком, используемым большинством тех, кто работает в государстве, в то время как латынь часто используется в религиозных церемониях.
453	4960341437383881404.wav	Ядерная бомба работает на принципе того, что для объединения ядра с большим количеством протонов и нейтронов требуется энергия.
454	5049759849654620438.wav	Болезнь переносится свиньями, которые затем переносятся на людей через комаров.
455	5059640273671690654.wav	Плато Гизы или Гизская Некрополь в египетской Долине Мертвых содержит несколько пирамид (самая большая из которых — Великая Пирамида), несколько небольших гробниц, несколько храмов и Великого Сфинкса.
456	5106380017322065030.wav	Однако это не так. Хотя на обороте документа есть что-то написано, это не карта сокровищ.
457	5111153817746112904.wav	Перед прибытием военных в Гаити не возникали проблемы, связанные с болезнью, начиная с 1800-х годов.
458	5131184112261114926.wav	Мост должен быть полностью функциональным к сентябрю 2017 года, когда предполагается завершение строительства бразильских таможенных пунктов.
459	5143306658627135996.wav	Оливер Сакс в своей статье Речь президента показал, как люди, не способные понять речь из-за повреждения мозга, тем не менее могут точно определить искренность.
