ID	audio	tgt_text
1	1003119935936341070.wav	Однако из-за медленных коммуникационных каналов стили на Западе могли отставать на 25-30 лет.
2	10052240106321793346.wav	Все существительные, а также слово Sie для обращения к вам, всегда пишутся с заглавной буквы, даже в середине предложения.
3	10167324587744183095.wav	На севере и в непосредственной близости находится романтический и захватывающий город Синтра, который стал известен иностранцам после восхищенного описания своих великолепий, оставленного лордом Байроном.
4	10197164397713068203.wav	Сок капусты меняет цвет в зависимости от того, насколько кислотным или щелочным является химическое вещество.
5	10233995782544396174.wav	Многие не считают их динозаврами, потому что у них есть перья и они умеют летать.
6	10235738076911595987.wav	Больница соблюдает протокол по контролю за инфекцией, включая изоляцию пациента от других для предотвращения возможного заражения других.
7	10323357556845456822.wav	Северно-Марианский офис управления чрезвычайными ситуациями заявил, что повреждений в стране не зафиксировано.
8	10335587906469246566.wav	Исследования двадцатого века показали, что существует два пула генетического вариативности: скрытый и проявленный.
9	10344335557154974057.wav	Соотношение сторон этого формата (для упрощения пересчитывается на целое число, разделив на 12) поэтому определяется как 3:2.
10	1036771894648013441.wav	Поскольку загрязнение светом в их расцвет было не таким проблемным, как сегодня, они обычно находятся в городах или на кампусах, более легко доступных, чем те, что построены в современные времена.
11	1038214857203833067.wav	Через ночь было сделано от 150 до 200 копий, известных сейчас как Брошюры Данлапа.
12	10383288285905292158.wav	Например, каждый год ученики школы Беннет в Северной Каролине создают веб-сайт о своей поездке в штатную столицу, каждый год веб-сайт реконструируется, но старые версии остаются онлайн в качестве альбома.
13	10405958125670257178.wav	Стаи львов ведут себя довольно похоже на стаи волков или собак, животных, поразительно похожих на львов (но не на других крупных кошек) в поведении, и также очень смертоносных к своей добыче.
14	10411016628242228511.wav	Город также является базой для восхождения на вулкан Нирагонго, а также одним из самых дешевых видов туризма - трекинг на горилл в горах - в Африке.
15	1042003289011443756.wav	Интернет объединяет элементы как массовой, так и межличностной коммуникации.
16	1043394666292127188.wav	Эти теории рассматривают, что делает определенных людей желать того, что они делают, и какие факторы в их окружении заставляют их делать или не делать определенные вещи.
17	1045619486290403122.wav	Например, наиболее распространенным форматом фотографий статичных изображений в мире является 35 мм, который был доминирующим размером пленки в конце эпохи аналоговой фотографии.
18	1046653381869710616.wav	Термин сафари в повседневном использовании относится к сухопутным путешествиям для наблюдения за потрясающей африканской дикой природой, в частности на саванне.
19	10471564175308895403.wav	Но есть много вещей в птицах, которые до сих пор напоминают динозавра.
20	10481451226514948764.wav	Женщинам рекомендуется заявлять, что они замужем, независимо от их фактического семейного положения.
21	10492135991603561867.wav	В некоторых районах достаточно кипятить воду одну минуту, в других требуется несколько минут.
22	10492761258488775721.wav	Любой, кто собирается водить автомобиль высоких широтах или по горным перевалам, должен учесть возможность снега, льда или заморозков.
23	10536763405165824117.wav	В результате два вида рыб стали вымершими, а два других оказались на грани исчезновения, включая горбатого чуба.
24	1054805305879816018.wav	Эту территорию управляли французы Виши. Это были французы, которые заключили мир с немцами в 1940 году и работали с захватчиками вместо того, чтобы сражаться против них.
25	10550734868852131138.wav	15 августа 1940 года союзники вторглись на юг Франции. Вторжение получило название Операция Драгун.
26	10614481583312370701.wav	Сплавы - это в основном смесь двух или более металлов. Не забывайте, что на таблице элементов много элементов.
27	10622204403793540766.wav	Например, каждый год студенты школы Беннет в Северной Каролине создают веб-сайт о своей поездке в столицу штата, каждый год сайт перерабатывается, но старые версии сохраняются в сети как антикварная книга.
28	10731896540541531669.wav	Его работа настолько высокого качества и детализирована, что он является одним из немногих известных имен среди филателистов. Некоторые специализируются исключительно на сборе его работ.
29	10751756685109361684.wav	Даниэлла Лантань, эксперт ООН по болезни, заявила, что вспышкой, вероятно, вызвали миротворцы.
30	10768814098664478369.wav	Другие номинации включают Лучший фильм, Режиссер, Операторское искусство, Костюмы, Монтаж фильма, Оригинальный саундтрек, Художественное оформление, Монтаж звука, Сведение звука и Оригинальный сценарий.
31	10849792007407044602.wav	Виртуальные команды придерживаются тех же стандартов качества, что и обычные команды, но есть некоторые тонкие различия.
32	10861831846737909528.wav	На севере регион ограничен Сахелем, а на юге и западе - Атлантическим океаном.
33	10894616243452123700.wav	Хорошо подготовленный спортсмен, тигр может лазить (хотя и не очень хорошо), плавать, прыгать на большие расстояния и тянуть силой в пять раз большей, чем у сильного человека.
34	10899527843662463911.wav	Он был затем переведен в больницу Адденбрука в Кембридже.
35	10903101168349732260.wav	Шоу звука и света у пирамид - одна из самых интересных вещей для детей в этом районе.
36	10933070083389897676.wav	Из-за подводной топологии обратное течение концентрируется в нескольких глубоких участках, и там может образоваться быстрый течущий поток в глубокие воды.
37	10937407360976471523.wav	Крушение произошло высоко в гористой местности и, по предположениям, было вызвано вражеским огнем.
38	10938576782105608041.wav	Блоги также могут помочь улучшить письменное обучение студентов. Хотя студенты часто начинают свой опыт блога с небрежной грамматикой и орфографией, присутствие аудитории, как правило, меняет это.
39	10969774925516121312.wav	Это важный способ различать некоторые глаголы и объекты.
40	11060294228176938598.wav	В результате два вида рыб стали вымершими, а два других находятся под угрозой исчезновения, включая горбатого толстолоба.
41	1107772981946748169.wav	Но у птиц всё ещё есть много черт, которые напоминают динозавра.
42	1111475259790805601.wav	Оливер Сакс в своей статье Речь президента утверждал, что люди, неспособные понимать речь из-за повреждения мозга, тем не менее могут точно оценить искренность.
43	11147918080606585533.wav	Козлы, похоже, впервые были одомашнены примерно 10 000 лет назад в Загросских горах Ирана.
44	1116140877447157610.wav	Путешественникам настоятельно рекомендуется быть в курсе возможного риска сильных погодных условий в их районе, так как это может повлиять на любые планы поездок.
45	1116401173651214130.wav	Во время этого периода европейской истории Католическая церковь, ставшая богатой и могущественной, стала подвергаться критике.
46	11200231708585274851.wav	По мере того, как знание греческого языка уменьшалось, Запад оказался отрезанным от своих греческих философских и научных корней.
47	11260391063812418810.wav	На прошлой неделе METI объявило, что Apple сообщила о 34 дополнительных инцидентах перегрева, которые компания назвала не серьезными.
48	11265842188315045636.wav	Население Ватикана составляет примерно 800 человек. Это самая маленькая независимая страна в мире и страна с наименьшим населением.
49	11318597463051480163.wav	Г-жа Киршнер объявила о своем намерении баллотироваться на пост президента в аргентинском театре, том же месте, где она начинала свою кампанию в качестве члена делегации провинции Буэнос-Айрес в 2005 году для выборов в Сенат.
50	11374239868879585530.wav	Горячий шоколад соответствует бельгийским стандартам. Фруктовые соки дорогие, но отличные.
51	11426556553252626005.wav	Порт был местом печального военного противостояния в 1889 году, когда семь кораблей из Германии, США и Великобритании отказались покидать порт.
52	11459777646810052940.wav	Построенная египтянами в третьем веке до н. э., Великая Пирамида - одна из многих больших пирамидных структур, построенных в честь умершего фараона.
53	1146643745158029931.wav	Цивилизация - это единая культура, разделяемая значительно большой группой людей, живущих и работающих совместно, общество.
54	11483786862560523973.wav	На севере и в пределах легкой доступности находится романтический и захватывающий город Синтра, который стал известен иностранцам после восхищенного описания его великолепий, оставленного лордом Байроном.
55	11497310594035767755.wav	Стаи львов ведут себя очень похоже на стаи волков или собак, животных, удивительно похожих на львов (но не на других крупных кошек) в поведении, и также очень смертоносных для своей добычи.
56	11504385604540375365.wav	Ученые надеются понять, как формируются планеты, особенно как образовалась Земля, так как кометы столкнулись с Землей давным-давно.
57	11525263464519603482.wav	Большинство современных исследовательских телескопов - это огромные сооружения в отдаленных районах с благоприятными атмосферными условиями.
58	1153104690713813269.wav	Если вы смотрели фильм Нацональный сокровище, возможно, вы думали, что карта сокровищ была написана на обороте Декларации независимости.
59	11536232800365538941.wav	Сундарбаны - крупнейший прибрежный мангровый пояс в мире, простирающийся на 80 км (50 миль) в глубь бангладешского и индийского побережья.
60	11554335886429174193.wav	В общем, можно выделить два типа поведения, которые могут проявиться, когда менеджеры начинают руководить своими бывшими коллегами. Один из вариантов - попытка оставаться одним из парней (или девушек).
61	11559094331412401332.wav	Ионы водорода - это протоны, у которых были отняты их электроны (поскольку атомы водорода состоят из одного протона и одного электрона).
62	11593450817032542587.wav	Сундарбаны являются крупнейшим прибрежным мангровым поясом в мире, простирающимся на 80 км (50 миль) вглубь бенгальского и индийского побережья.
63	11596505942268625598.wav	На протяжении 1960-х годов Бжезинский работал советником Джона Кеннеди, а затем в администрации Линдона Джонсона.
64	11617272550749387741.wav	Куомо, 53 года, начал свое губернаторство ранее в этом году и подписал закон в прошлом месяце, легализующий однополые браки.
65	11665346626937246597.wav	Телевизионные репортажи показывают белый дым, идущий из завода.
66	11668734600035674277.wav	Правящая партия, Организация Народа Юго-Западной Африки (SWAPO), также сохраняла мажоритарное положение на парламентских выборах.
67	11670188897888947692.wav	Ничего не видно, кроме ясного, красивого неба над головой и многочисленных окружающих гор. Изнутри пещеры можно видеть или услышать очень мало этого мира.
68	11705046490861852963.wav	Сначала большинство наездников носят сапоги для верховой езды с каблуком и гладкой, довольно узкой подошвой.
69	11766033532714442721.wav	С 1966 года Сундарбанс являются заповедником, и предполагается, что в этой области сейчас проживает около 400 королевских бенгальских тигров и приблизительно 30 000 оленей.
70	11781376959217630586.wav	Национальный парк Плитвицкие озёра плотно покрыт лесами, в основном из бука, пихты и ели, и характеризуется смешением альпийской и средиземноморской растительности.
71	11820398005906165915.wav	Также после Революции профессии были открыты для всех мужчин-заявителей, позволяя самым амбициозным и успешным добиться успеха.
72	11827077161070295147.wav	Сцены отображаются на пирамидах, и различные пирамиды освещены.
73	11853072634976133891.wav	Эти пары могут решить составить план по усыновлению для своего ребенка.
74	11880309600276730497.wav	Точно так же, имея визу Шенгена, вам не нужно подавать заявку на визы в каждую страну-члена Шенгенского соглашения отдельно, что экономит время, деньги и бумажную волокиту.
75	11966709226632417907.wav	Все во Вселенной сделано из вещества. Все вещество состоит из крошечных частиц, называемых атомами.
76	11974497390699501411.wav	Это находка также дает представление о эволюции перьев у птиц.
77	11987168412167267165.wav	Влага на ваших руках взаимодействует с внешними слоями, что будет ощущаться странно и образует своеобразную оболочку.
78	12018418318980824126.wav	Это называется pH химического вещества. Вы можете создать индикатор, используя сок красной капусты.
79	12156117084384995618.wav	Только мутации в герминативных клетках могут передаваться детям, в то время как мутации в других местах могут вызывать гибель клеток или рак.
80	12164368102080603077.wav	Офис губернатора заявил, что девятнадцать пострадавших - полицейские.
81	1218355507714944126.wav	В свои ранние дни передача транслировалась исключительно на долгоживущем интернет-радио TogiNet Radio, специализирующемся на ток-шоу.
82	12190760535244332971.wav	Плато Гизы, или «Гизенекрополь» в египетской Долине Мертвых, содержит несколько пирамид (среди которых самая большая - Великая пирамида), несколько маленьких гробниц, несколько храмов и Великого Сфинкса.
83	12200368278244671662.wav	Эти пары могут решить составить план усыновления для своего малыша.
84	12230326991067783666.wav	Соединенные Штаты Америки по гимнастике и Олимпийский комитет США имеют одну и ту же цель: сделать вид спорта, такой как гимнастика, по возможности безопасным для атлетов, чтобы они могли следовать своим мечтам в безопасной, позитивной и поддерживающей атмосфере.
85	12239464249642485259.wav	РС - это заболевание, которое влияет на центральную нервную систему, состоящую из мозга, спинного мозга и зрительного нерва.
86	12316410148883063626.wav	Поделиться виртуальной экскурсией - отличный способ вспомнить поездку и поделиться опытом с будущими классами.
87	12356293452530186109.wav	Каждый участвует в обществе и пользуется транспортными системами. Почти все жалуются на транспортные системы.
88	12381237049043414166.wav	Мухаммад глубоко интересовался делами, выходящими за пределы этой мирской жизни. Он часто посещал пещеру, которая стала известной как Хира, на горе Нур (свет) для размышлений.
89	12382404601461539160.wav	На некоторых маршрутах у крупных компаний есть свои собственные самолеты, но для других маршрутов и маленьких фирм возникала проблема.
90	1242235796224521830.wav	Парад зданий, составляющих горизонт Гонконга, сравнивают с сверкающей столбчатой диаграммой, видимой благодаря присутствию вод Виктория-Гарбор.
91	12442340605801616197.wav	Соотношение сторон этого формата (получаемое путем деления на двенадцать для получения самого простого целочисленного соотношения) поэтому говорится быть 3:2.
92	12462354014280856258.wav	Эпоху, в которую происходили события, обычно называют высокими средневековьем - период европейской истории XI, XII и XIII веков (1000-1300 гг. н.э.).
93	12517884865939916901.wav	Он утверждает, что наиболее эффективным местом для основного объекта является пересечение линий, разделяющих изображение на третьи вертикально и горизонтально (см. пример).
94	125194026787628519.wav	Куомо, 53 года, начал свою губернаторскую деятельность ранее в этом году и подписал закон в прошлом месяце, легализующий однополые браки.
95	12519810849995407480.wav	Это также может быть полезным иметь Wild Card, который предоставляет доступ либо к выбранным паркам в Южной Африке, либо ко всем южноафриканским национальным паркам.
