ID	audio	tgt_text
0	ted_1_0.wav	Mi piacerebbe invitarti a un piccolo esperimento di pensiero.
1	ted_1_1.wav	Facciamo finta che stiamo per partire insieme per una spedizione polare, tutti voi e io, e dobbiamo assumere un capitano.
2	ted_1_3.wav	Uno proviene da un uomo che ha già raggiunto con successo tutti e quattro gli obiettivi polari principali, il Polo Nord e il Polo Sud, e i Passaggi a Nordest e Nordovest.
3	ted_1_4.wav	In effetti, tre di questi furono le prime cose che lui realizzò.
4	ted_1_6.wav	Il candidato B è un uomo che si è recato in Antartide quattro volte, tre volte come responsabile, e ogni volta ha avuto come risultato un fallimento, una catastrofe o la morte.
5	ted_1_12.wav	Ma in realtà, spesso ci illudiamo di assumere il Candidato B o qualcuno simile a lui.
6	ted_1_14.wav	Nel frattempo, il Candidato A, il norvegese Roald Amundsen, per qualsiasi metrica, l'esploratore polare più di successo che sia mai vissuto, è stato in gran parte dimenticato.
7	ted_1_15.wav	Ho fatto una rapida ricerca nel catalogo della biblioteca della mia università prima di questa presentazione, e ho trovato niente meno di 26 libri che celebrano le qualità di leadership di Shackleton.
8	ted_1_16.wav	Per Amundsen, ne ho trovate quattro, due delle quali ho scritto.
9	ted_1_18.wav	Perché siamo ossessionati da un leader mediocre al meglio e trascuriamo uno veramente dotato?
10	ted_1_19.wav	Beh, sono uno storico che studia la leadership, e sono qui per dirti che celebriamo i leader sbagliati, e non solo nel campo dell'esplorazione polare.
11	ted_1_20.wav	Probabilmente parlate di lui intorno alle macchine del caffè al mattino.
12	ted_1_22.wav	È nato come schiavo analfabeta e si è alzato per diventare uno dei rivoluzionari più influenti di sempre, riuscendo a superare gli imperi più grandi del tempo, inclusi quelli di Napoleone.
13	ted_1_25.wav	E questo non è solo un'intuizione accademica o banale.
14	ted_1_28.wav	Tutte le sfide che affrontiamo oggi richiedono che le persone lavorino insieme, e ciò, a sua volta, richiede qualcuno che possa motivarle, ispirarle, coordinare il lavoro, affrontare eventuali intoppi che potrebbero sorgere lungo il cammino.
15	ted_1_29.wav	Ma per questo motivo, è importante che celebreremo i leader giusti, perché i leader che celebriamo sono i leader da cui impariamo.
16	ted_1_30.wav	E quindi in questo senso, i leader che celebreremo hanno un impatto diretto sul successo, o come potrebbe essere il fallimento, dei nostri maggiori sforzi oggi.
17	ted_1_33.wav	Ma c'è anche un altro colpevole che agisce, quello che mi piace chiamare la fallacia dell'azione.
18	ted_1_34.wav	La nostra errata convinzione che i migliori leader siano coloro che generano il maggior rumore, azione e attività sensazionale nelle circostanze più drammatiche.
19	ted_1_35.wav	In altre parole, confondiamo una buona storia con un buon leadership.
20	ted_1_37.wav	In realtà, molto spesso, una buona leadership si tradurrà in una brutta storia.
21	ted_1_39.wav	Immagina il leadership per un momento non come un esploratore polare che traccia un nuovo percorso o come un CEO che motiva il suo staff, ma come il semplice atto di nuotare attraverso un fiume.
22	ted_1_41.wav	Immagina un fiume violento con onde che si infrangono l'una contro l'altra e rocce che si nascondono da qualche parte sotto la superficie.
23	ted_1_42.wav	Se un nuotatore si avventura in modo casuale, senza essere consapevole delle proprie capacità o delle correnti, e quasi annega, ma si dimena freneticamente, lotta con tutte le sue forze e in qualche modo, miracolosamente, riesce a trascinarsi in salvo, chiunque di noi stia osservando lo noterà.
24	ted_1_45.wav	Ha veramente lottato duramente per uscire da quella crisi.
25	ted_1_46.wav	E se invece abbiamo una nuotatrice che ha studiato il fiume per anni e sa esattamente dove e quando entrare nell'acqua e come girare il corpo in modi sottili, e così lascia che la corrente la porti attraverso, probabilmente non la noteremo.
26	ted_1_47.wav	E se lo facessimo, probabilmente diremmo, Eh, sembra piuttosto facile.
27	ted_1_49.wav	E lui e i suoi uomini furono quindi costretti ad intraprendere un pericoloso viaggio attraverso il ghiaccio e a affrontare alcuni dei mari più tempestosi sulla Terra prima di raggiungere infine la sicurezza della Georgia del Sud nell'estate del 1916.
28	ted_1_52.wav	Infatti, è stata trasformata in una serie TV con il giovane Kenneth Branagh.
29	ted_1_53.wav	Ma non è una storia adatta per trarne lezioni di leadership.
30	ted_1_54.wav	Ha ignorato il consiglio dei balenieri locali che gli hanno detto che il ghiaccio era particolarmente pericoloso quella stagione.
31	ted_1_55.wav	E ha trascurato enormi deficit nel suo equipaggiamento, nella preparazione, nella selezione dell'equipaggio e nella formazione.
32	ted_1_57.wav	Raramente evidenziato nei numerosi libri che celebrano le sue qualità di leadership è il fatto che la nave dell'esplorazione, l'Aurora, ha subito una crisi ancora più grave, che ha comportato la perdita di tre vite.
33	ted_1_58.wav	Al contrario, le spedizioni di un Roald Amundsen sono noiose da leggere.
34	ted_1_59.wav	Non perché fosse fortunato, ma grazie alla sua intima conoscenza dell'ambiente polare, alla sua pianificazione attenta e ponderata e al suo autentico e innovativo leadership sul campo, è riuscito a ridurre al minimo i problemi che la sua squadra ha incontrato.
35	ted_1_60.wav	Nel 1905, riuscì, su una piccola imbarcazione da pesca, a fare ciò che la potente Marina Britannica non era riuscita a fare nei precedenti otto decenni, cioè trovare e navigare il Passaggio a Nord-Ovest sopra il continente canadese.
36	ted_1_61.wav	Se Shackleton è il nuotatore che si getta imprudentemente in acqua senza capire le correnti o le proprie capacità, Amundsen è il nuotatore che ha passato una vita umilmente studiando il fiume prima di entrare in acqua nel posto giusto al momento giusto, e così rende tutto facile.
37	ted_1_62.wav	Ora, la fallacia dell'azione causa veri problemi, e non solo per la nostra interpretazione del passato.
38	ted_1_63.wav	Sono giunto a questo attraverso il mio lavoro di storico interessato al motivo per cui celebriamo alcuni leader del passato, ma non altri.
39	ted_1_64.wav	Ma è una caratteristica pericolosa anche nei nostri uffici oggi, perché, in fondo, gli stessi pregiudizi e fraintendimenti che portiamo alla nostra lettura del passato sono gli stessi con cui vediamo il leadership nei nostri uffici oggi.
40	ted_1_65.wav	Sono gli Shackleton dei nostri uffici, piuttosto che gli Amundsen, che fungono da modelli da seguire, che vengono promossi e che vengono premiati.
41	ted_1_66.wav	Infatti, questo è qualcosa che gli studi di psicologia organizzativa hanno confermato.
42	ted_1_67.wav	Vediamo il potenziale di leadership nelle persone che parlano di più, indipendentemente da ciò che dicono.
43	ted_1_68.wav	Nelle persone che appaiono sicure di sé, a prescindere da quanto competenti siano.
44	ted_1_69.wav	E abbiamo un'indefettibile ammirazione per le persone sempre impegnate, indipendentemente da ciò che stanno effettivamente facendo.
45	ted_1_70.wav	Vedo che alcuni di voi stanno immaginando persone specifiche nel vostro ufficio in questo momento.
46	ted_1_72.wav	In altre parole, apparire come un buon leader, piuttosto che esserlo effettivamente dietro le quinte, è il percorso verso la fama, il bonus e la promozione oggi.
47	ted_1_74.wav	Con i leader sbagliati al comando, le organizzazioni ovviamente non stanno operando al massimo delle loro potenzialità.
48	ted_1_75.wav	E crea una cultura tossica in cui coloro che effettivamente stanno facendo un buon lavoro si sentono trascurati e demotivati.
49	ted_1_76.wav	Quindi questo è un problema che dobbiamo risolvere.
50	ted_1_78.wav	E comincia con immaginare di nuovo com'è un buon leadership.
51	ted_1_80.wav	Prima di tutto, dobbiamo imparare a ignorare ciò che possiamo definire i capitani delle crisi, i Shackleton, coloro che vacillano da una circostanza drammatica all'altra.
52	ted_1_81.wav	Keith Grint, il preminente studioso della leadership oggi, riassume brillantemente questa dinamica problematica.
53	ted_1_82.wav	Poiché premiamo le persone che si comportano bene nelle crisi e ignoriamo le persone che sono tali buoni manager che ci sono poche crisi, le persone imparano presto a cercare o modificare le situazioni come fossero crisi.
54	ted_1_83.wav	Dobbiamo disincentivare questo stile di leadership rifiutando di dare a queste persone l'attenzione che desiderano.
55	ted_1_84.wav	E questo è facile quando ci confrontiamo con i fatti sobri.
56	ted_1_86.wav	Ma non appena è inserito in una storia, i dettagli drammatici ci attraggono come un magnete e ci danno una falsa sensazione di ispirazione.
57	ted_1_88.wav	Dobbiamo invece imparare a celebrare coloro che mitigano invece che promuovere il dramma.
58	ted_1_89.wav	E questo può essere impegnativo perché spesso lo fanno in modo molto sottile, sotto la superficie dell'acqua, nel caso del nostro nuotatore.
59	ted_1_91.wav	Costruiscono processi che allineano la forza dell'organizzazione con le sfide uniche che affrontano.
60	ted_1_92.wav	E sono autentici e creano culture che tirano fuori il meglio dalle persone.
61	ted_1_93.wav	Non voglio darti troppe terminologie tecniche o accademiche qui, ma questa è importante.
62	ted_1_95.wav	Ma come ci dice dalla sua ricerca, le prove sono chiare: la gestione noiosa conta.
63	ted_1_96.wav	Potrebbe non essere così entusiasmante come guidare un attacco di cavalleria dall'avanguardia o fare un discorso di incoraggiamento spericolato, ma è il vero kit degli ottimi leader.
64	ted_1_98.wav	L'errore dell'azione ci inganna nel celebrare i leader sbagliati, e ciò comporta costi enormi.
65	ted_1_101.wav	E questo inizia reinventando cosa significa essere un buon leader.
66	ted_1_102.wav	Quindi la prossima volta che ti trovi in una posizione per giudicare o premiare un leader, o forse proprio la prossima volta che stai cercando di capire quali sforzi hanno effettivamente guidato il tuo team o organizzazione al successo, resisti alla tentazione di farti abbagliare dalle storie di avventura e audacia, e prenditi un attimo per guardare al di sotto della superficie o negli angoli più silenziosi del tuo team.
67	ted_1_103.wav	E questo è importante perché la prossima volta che la tua organizzazione si trova di fronte all'equivalente di un ghiacciaio che incombe all'orizzonte, chi vuoi che sia al comando?
68	ted_1_104.wav	Il capo che risponde al blocco della nave girando freneticamente il motore, sballando le casse di dinamite e spingendo i suoi uomini fino al punto di rottura?
69	ted_1_105.wav	Oppure il leader che evita di rimanere bloccato nel ghiaccio fin dall'inizio?
70	ted_2_1.wav	Ho votato per Mitt Romney nel 2012, e ho votato per Hillary Clinton e Joe Biden, cosa che è sorprendente, lo so.
71	ted_2_2.wav	Sono un fiero sostenitore di Israele, anche se critico il suo attuale governo.
72	ted_2_3.wav	Penso che i terroristi come Hamas e Hezbollah siano malvagi, e che ci sia una netta distinzione tra gruppi che mirano a uccidere innocenti e quelli che cercano di evitare di farlo a ogni costo.
73	ted_2_4.wav	Penso che le ragazze in Afghanistan non dovrebbero essere vendute in matrimoni infantili e che le donne in Iran dovrebbero essere libere di mostrare i capelli in pubblico senza il timore di essere imprigionate o peggio, e che le donne in Somalia non dovrebbero subire mutilazioni genitali.
74	ted_2_5.wav	Credo che tutte le persone siano create uguali e create all'immagine di Dio, ma che tutte le culture non siano uguali.
75	ted_2_6.wav	Credo nel matrimonio gay, tanto che sono attualmente sposato con una persona dello stesso sesso.
76	ted_2_7.wav	Credo che gli adulti dovrebbero poter prendere praticamente qualsiasi decisione riguardo ai loro corpi, ma che i bambini non dovrebbero farlo.
77	ted_2_8.wav	Penso che il SAT sia uno strumento imperfetto ma utile.
78	ted_2_9.wav	Credo che avere figli sia un'idea molto sbagliata e che vivere in un quartiere sicuro sia una delle forme di privilegio più vere.
79	ted_2_10.wav	Penso che il COVID probabilmente sia venuto da un laboratorio, e che a posteriori chiudere le scuole per i bambini per due anni sia stato un grosso errore.
80	ted_2_11.wav	Penso che dovremmo assumere le persone in base al loro merito, ma allargare il più possibile la rete.
81	ted_2_12.wav	Non voglio mangiare insetti, né voglio bere acqua piena di microplastica, e non penso che ci sia qualcosa di codificato a destra o a sinistra riguardo a nessuna delle due cose.
82	ted_2_13.wav	Credo che l'uguaglianza di opportunità e non l'uguaglianza di risultato sia il vero metro di giustizia.
83	ted_2_14.wav	Sono respinto dalle ideologie che insistono sul fatto che le nostre caratteristiche immutabili siano più importanti del nostro carattere.
84	ted_2_19.wav	Credo, in parte perché gli americani sono liberi di discutere di quei difetti e di cercare un'unione più perfetta, che veramente è l'ultima migliore speranza sulla terra.
85	ted_2_20.wav	Il punto di tutto questo è che sono davvero noioso, o almeno credevo di esserlo.
86	ted_2_21.wav	Sono, o almeno fino a pochi secondi fa nel tempo storico, ero considerato un liberale di base standard.
87	ted_2_22.wav	E tuttavia, in spazi intellettuali e prestigiosi come questi, molte delle idee che ho appena delineato e altre simili sono diventate provocatorie o controverse, il che è davvero un modo gentile per dire indesiderate, oltre il limite, addirittura bigotte o razziste.
88	ted_2_23.wav	E come è successo, almeno così mi sembra, nel giro di pochi anni?
89	ted_2_24.wav	Ora, la risposta conveniente, naturalmente, è il potere degli attivisti estremisti, persone che incendiano aziende e stazioni di polizia, persone che bloccano ponti e autostrade, persone che molestano i loro compagni di studi e interrompono i loro professori, persone che vandalizzano, che profanano o abbattano monumenti di eroi nazionali.
90	ted_2_25.wav	Ma un pugno di attivisti estremi ha davvero il potere di smantellare le barriere etiche di un'intera società, di spostare radicalmente il concetto di ciò che è politicamente e socialmente accettabile?
91	ted_2_27.wav	C'è sempre stata e ci sarà sempre una frangia.
92	ted_2_28.wav	La differenza in questo momento è che sembra essere la frangia a dettare le regole.
93	ted_2_31.wav	Forse per interpretare nel modo più generoso, è perché le persone che chiudono le cose sostengono di farlo in nome della giustizia, non in nome del nichilismo.
94	ted_2_33.wav	Forse è perché ci siamo detti che sono solo alcuni noci, non ho bisogno di coinvolgermi.
95	ted_2_34.wav	Forse è anche perché le persone hanno guardato il loro portafoglio e hanno deciso che stavano facendo bene numericamente e quelle porte antifiamma, eh, probabilmente avevano comunque l'assicurazione.
96	ted_2_38.wav	Forse perché pensavamo che avessero ragione.
97	ted_2_39.wav	Quell'America e l'Occidente erano davvero colpevoli di tutte le cose terribili che dicevano o almeno di alcune di esse.
98	ted_2_40.wav	E sebbene non avremmo abbattuto statue o urlato contro i relatori, ci mancava la convinzione o le idee per fermare le persone che lo facevano.
99	ted_2_41.wav	O forse perché alla fine abbiamo preferito il comfort alla complessità.
100	ted_2_42.wav	Stavo per dire che preferivo il comfort al valore, ma la verità non è qualcosa che si estrae dal terreno come l'oro o i diamanti.
101	ted_2_43.wav	Ecco perché in questo momento sembra che gli integralisti stiano vincendo.
102	ted_2_44.wav	La mia teoria è che il motivo per cui abbiamo una cultura in crisi è a causa della codardia delle persone che sanno meglio.
103	ted_2_50.wav	Esso ti espone come qualcuno che non è tranquillo, come qualcuno che si preoccupa molto, come qualcuno che giudica, come qualcuno che distingue tra il giusto e il sbagliato, tra il migliore e il peggiore.
104	ted_2_51.wav	La ragione per cui Aristotele ha chiamato il coraggio la prima virtù è perché è quella che rende possibile tutte le altre virtù.
105	ted_2_52.wav	Vuoi vivere in un mondo che valorizza la giustizia, la saggezza, la compassione, la curiosità, la razionalità, l'uguaglianza e la ricerca della verità?
106	ted_2_54.wav	Ma combattere per assicurarci di vivere in un mondo del genere richiederà coraggio, quella prima virtù.
107	ted_2_55.wav	Penso che una delle lezioni dell'ultimo decennio sia che la codardia è forse più contagiosa del COVID.
108	ted_2_57.wav	E un esempio singolare può fungere da potente mezzo di trasmissione.
109	ted_2_59.wav	Ciascuno di voi, quando dico la parola coraggio, avrà quelli che gli vengono in mente.
110	ted_2_60.wav	Ma per me, sono persone come Salman Rushdie, condannato a morte dagli Ayatollah iraniani nel 1989 per il peccato di aver scritto un romanzo.
111	ted_2_61.wav	Ha vissuto all'ombra di una fatwa fino a due anni fa.
112	ted_2_62.wav	Su un palcoscenico come questo, fu ferocemente accoltellato.
113	ted_2_64.wav	E impavido questa settimana, naturalmente, ha pubblicato un libro a riguardo.
114	ted_2_65.wav	Il coraggio per me è qualcuno come il Senatore della Pennsylvania John Fetterman, che insiste sul fatto che non c'è nulla di contraddittorio tra i suoi valori progressisti e la sua convinzione che Hamas sia un gruppo di assassini che devono essere sconfitti.
115	ted_2_66.wav	Ora basta dire che questo non lo ha reso popolare, ma a lui non sembra importare.
116	ted_2_72.wav	Ha scritto, non potevo credere che stesse succedendo in un paese che amo così tanto.
117	ted_2_74.wav	Ha detto che la guarigione del mondo inizia con una persona che dice ad alta voce in modo che tutto il mondo possa udire una cosa importante e vera che sa di non dover dire e che sa gli darà problemi per averla detta.
118	ted_2_75.wav	Penso a Roland Fryer, l'economista, che ha fatto proprio questo.
119	ted_2_76.wav	I suoi colleghi di Harvard lo hanno messo in guardia dal pubblicare la ricerca che ha fatto sulla violenza della polizia.
120	ted_2_84.wav	Il suo bambino aveva sette giorni di vita e doveva andare a comprare pannolini accompagnato da una guardia armata.
121	ted_2_88.wav	Ha detto, ogni giorno devo guardarmi allo specchio e chiedermi, per cosa sei qui?
122	ted_2_89.wav	Masia Linajad sa perché è stata messa sulla terra.
123	ted_2_90.wav	Con grinta e coraggio, lei sta guidando la campagna per i diritti delle donne in Iran.
124	ted_2_91.wav	Sua sorella è stata costretta a denunciarla in televisione statale.
125	ted_2_93.wav	E adesso Masi vive in esilio in America, ma rimane una donna braccata, spostandosi da un rifugio sicuro all'altro.
126	ted_2_95.wav	Jimmy aveva più dei mezzi per fuggire dal suo paese.
127	ted_2_101.wav	Lui è un giovane uomo che è ancora in prigione.
128	ted_2_103.wav	Papà che rimane a Hong Kong è davvero la prova che questa cosa intangibile che chiamiamo libertà è una cosa che le persone desiderano ardentemente.
129	ted_2_104.wav	Puoi chiamarle valori occidentali, ma in realtà non lo sono nel senso che non è qualcosa che solo le persone in Occidente vogliono o meritano.
130	ted_2_105.wav	Alexei Navalny non è nato in Occidente, ma bramava quel tipo di libertà.
131	ted_2_106.wav	Il leader dell'opposizione si era rifugiato in Germania, ma è tornato in Russia di Putin, sacrificando la sua libertà e, alla fine, la sua vita per opporsi alla tirannia.
132	ted_2_107.wav	"""Sa che la sua morte metterà in luce la verità su un regime totalitario costruito sulle bugie, ciò che può fare finché manteniamo viva la sua memoria."""
133	ted_2_108.wav	Chiediti proprio ora, dovrebbe occorrere coraggio in Occidente per denunciare l'ideologia odiosa della Repubblica Islamica dell'Iran, che pronuncia la morte su scrittori individuali e su interi paesi, grandi e piccoli?
134	ted_2_109.wav	Dovrebbe essere necessario coraggio per opporsi a coloro che intonano slogan di morte contro l'America?
135	ted_2_111.wav	Dovrebbe occorrere coraggio dire che coloro che lodano le metropolitane incontaminate della Russia non sono giornalisti ma propagandisti?
136	ted_2_112.wav	Dovrebbe richiedere coraggio dire in pubblico, non sono d'accordo?
137	ted_2_115.wav	Ma perché è che i suoi avversari più arrabbiati preferiscono chiamarlo con nomi odiosi e fare pressioni per il suo sostegno?
138	ted_2_116.wav	Perché la vera domanda è se le persone che ho menzionato e quelle simili a loro, che siano le loro foto e i loro nomi, e, cosa più importante, le loro idee, compariranno a conferenze come questa.
139	ted_2_118.wav	Ho avuto abbastanza persone che mi confessano dopo le conferenze o nelle redazioni o nei campus universitari o nelle aziende o nei caffè, davvero ovunque io vada, che vorrebbero poter dire ciò in cui credono.
140	ted_2_119.wav	Mi dicono con una certa misura di vergogna di essere nascosti nelle nostre democrazie liberali.
141	ted_2_121.wav	Le persone più libere nella storia del mondo sembrano aver perso la fame di libertà, o forse è davvero la volontà di difenderla.
142	ted_2_122.wav	E quando mi dicono questo, mi ricorda il mio eroe, Natan Sharansky, che ha trascorso un decennio nel Gulag sovietico prima di ottenere la sua libertà.
143	ted_2_123.wav	Lui è la persona più coraggiosa che abbia mai incontrato nella mia vita.
144	ted_2_124.wav	E qualche anno fa, un pomeriggio a Gerusalemme, gli ho fatto una semplice domanda.
145	ted_2_125.wav	Natan, gli ho chiesto, è possibile insegnare il coraggio?
146	ted_2_126.wav	E sorrise nel suo modo birichino e disse, no.
147	ted_2_127.wav	Tutto ciò che puoi fare è far vedere alle persone quanto sia bello sentirsi liberi.
148	ted_2_139.wav	Ma questi problemi sono così importanti, e questa è una conversazione così importante.
149	ted_2_140.wav	Penso che voglia chiederti qualcosa nella ricerca di un terreno comune qui.
150	ted_2_141.wav	È possibile che oltre alla mancanza di coraggio, ci sia qualcos'altro di importante che sta accadendo nei cuori di molti della maggioranza silenziosa?
151	ted_2_144.wav	Questi sono spesso dibattiti tra gruppi identitari, e molti di noi non apprezzano il modo in cui sta procedendo la battaglia, ma sentiamo profondamente il dolore che molti di questi gruppi hanno subito, le ingiustizie che hanno patito.
152	ted_2_145.wav	E se ti coinvolgi, può essere facilmente interpretato come se fossi contro quel gruppo.
153	ted_2_146.wav	E immagino mi chiedo se c'è un terreno comune da trovare nel fatto che tutti noi diciamo che l'identità conta davvero.
154	ted_2_147.wav	Intendo, ti interessano le ingiustizie del passato delle persone in America e di tutti i diversi gruppi di cui hai parlato, ma ci sono alcune cose che sono ancora più importanti rispetto all'identità. 
155	ted_2_152.wav	Credo fermamente in questo.
156	ted_2_153.wav	Credo riguardo alle idee.
157	ted_2_154.wav	Sai, che alcune persone vogliono dire che le idee sono di proprietà di un gruppo e che tu, lo sai, ma no, no, tutto il nostro TED si basa sull'idea che le idee possano diffondersi da qualsiasi essere umano a qualsiasi altro essere umano.
158	ted_2_155.wav	Ma la vera domanda è, scusa se ti interrompo, come si arriva alla verità, giusto?
159	ted_2_156.wav	E l'Occidente ci ha fornito gli strumenti più radicali nella storia dell'umanità.
160	ted_2_158.wav	Ma la partenza radicale è che qui, in stanze come questa, in culture come quelle in cui abbiamo la fortuna di vivere, non risolviamo i nostri conflitti con colpi e violenza.
161	ted_2_159.wav	Risolviamo con le parole.
162	ted_2_160.wav	Ecco perché è così assolutamente cruciale, non importa quanto le persone che affermano di farlo, stiano davvero promuovendo di bruciare tutto o distruggere tutto.
163	ted_2_161.wav	No, distruggendo tutto, abbattendo lo stato di diritto, impedendoci di poter avere questo tipo di dibattito e discussione, stai prevenendo il progetto nel suo complesso.
164	ted_2_162.wav	E questo non ha nulla a che fare con l'identità, con richieste di vittimismo, con il vero vittimismo.
165	ted_2_163.wav	Il progresso è stato raggiunto interamente dai gruppi di vittime utilizzando gli strumenti forniti loro dalle democrazie liberali.
166	ted_2_164.wav	Senza libertà, senza libertà di parola, libertà di religione, senza lo Stato di diritto, nessuno dei progressi che conosco tante persone in questa stanza festeggiano sarebbero possibili affatto.
167	ted_2_167.wav	Non si sente come parole e esplorazione della verità.
168	ted_2_168.wav	Viene percepito come odio o critica.
169	ted_2_170.wav	Non lasciamoci spaventare dal condividere le cose difficili l'uno con l'altro, ma facciamolo con spirito d'amore e rispetto, in modo che tutti possano sapere che nel cuore sono rispettati.
170	ted_2_171.wav	Stiamo tutti cercando di rendere le cose migliori.
171	ted_2_172.wav	Non vedo nulla su cui dissentire, solo che, sai, come, amore e compassione e tutto ciò, di nuovo, è possibile solo se accettiamo un certo insieme di regole che credo molti di noi davano per scontate come facciamo con l'ossigeno o la gravità.
172	ted_2_173.wav	E una delle cose che mi ha guidato e influenzato le mie scelte negli ultimi anni della mia vita è un profondo senso che la linea tra civiltà e barbarie, una parola che forse provocherà alcune persone, ma che ritengo sia una descrizione accurata, è sottilissima.
173	ted_3_0.wav	Sono qui a causa di una lettera che ho ricevuto 13 anni fa.
174	ted_3_3.wav	È un rapporto di test genetico predittivo, ed è al centro di questo tipo di momento della scelta tra la pillola rossa e la pillola blu quando la mia vita si è divisa in due.
175	ted_3_4.wav	Prima di raccontarti di quello, voglio mostrarti due momenti della mia vita di allora.
176	ted_3_5.wav	Questo è il primo momento, quando avevo vent'anni, e questo è il primo momento, è agosto 2009.
