ID	audio	tgt_text
384	ted_5_117.wav	Qualsiasi lingua umana è ora l'unica abilità di cui hai bisogno per iniziare la programmazione informatica.
385	ted_5_118.wav	Questo porterà a un'impetuosa globalizzazione di sviluppatori di software e ridisegnerà la geografia della nostra economia globale.
386	ted_5_119.wav	E per questo motivo, credo che entro il 2030, forse anche prima, avremo più di 1 miliardo di sviluppatori di software su GitHub.
387	ted_5_120.wav	Questo genererà una nuova rinascita della creatività umana con il software.
388	ted_5_121.wav	Ora, chiunque qui in questa stanza potrebbe avere un'idea brillante proprio adesso, un sito web, un'applicazione, un fantastico videogioco, una canzone straordinaria, forse persino una cura per qualcosa.
389	ted_5_122.wav	Ad esempio, l'anno scorso, per un paio di settimane, ho sviluppato un'applicazione che tiene traccia di tutti i voli che ho mai preso nella mia vita.
390	ted_5_125.wav	Eh sì, è vero, amo costruire roba del genere.
391	ted_5_126.wav	E con l'aiuto dell'IA, ora posso farlo in inglese o in tedesco prima ancora di finire un bicchiere di vino.
392	ted_5_127.wav	E presto, questo sarà vero per tutti qui.
393	ted_5_129.wav	Ora, questo non significa che tutti diventeranno sviluppatori software professionisti, o anche che dovrebbero farlo.
394	ted_5_130.wav	La professione di uno sviluppatore software professionale non sta andando da nessuna parte.
395	ted_5_131.wav	Ci sarà sempre domanda per coloro che progettano e mantengono i più grandi sistemi software del mondo.
396	ted_5_132.wav	Stiamo aggiungendo milioni di righe di codice ogni singolo giorno a sistemi sempre più complessi, e faticiamo a malapena a mantenere quelli esistenti.
397	ted_5_133.wav	Come qualsiasi infrastruttura in questo mondo là fuori, abbiamo bisogno di veri esperti per preservarla e rinnovarla.
398	ted_5_134.wav	Il punto qui non è una volontà o un dovere.
399	ted_5_135.wav	E' che chiunque può farlo, tutto grazie al sistema più potente che abbiamo, ogni lingua umana, è ora fusa con la lingua di una macchina.
400	ted_5_136.wav	E molto presto, creare software sarà altrettanto semplice e gioioso come impilare un Lego.
401	ted_5_138.wav	Accidenti, devo dire che un miliardo di sviluppatori fa sembrare GitHub più simile a YouTube e TikTok di quanto non lo sia oggi.
402	ted_5_140.wav	Devo farti una domanda, forse l'elefante nella stanza.
403	ted_5_143.wav	Hai anche detto che abbiamo avuto tre salti in tre anni.
404	ted_5_144.wav	Facendo un piccolo salto avanti, pensi che gli esseri umani dovranno ancora essere coinvolti, oppure questi sistemi di intelligenza artificiale saranno in grado di costruire e mantenere software autonomamente?
405	ted_5_145.wav	Sai, il modo in cui io penso sempre a ciò e ne parlo è che l'abbiamo chiamato Copilota per una ragione.
406	ted_5_146.wav	Abbiamo bisogno di un pilota creativo, che sappia decidere cosa fare.
407	ted_5_148.wav	Devi prendere questo grande problema e scomporlo in problemi più piccoli, in piccoli blocchi costruttivi.
408	ted_5_155.wav	Oggi sono un paio di righe di codice, forse un intero file.
409	ted_5_157.wav	Quindi ottengo più lavoro togliendomi di dosso, ma sono comunque lì a coprire il grande sistema.
410	ted_5_158.wav	E come ho accennato, stiamo ancora utilizzando sistemi COBOL dagli anni '60.
411	ted_5_162.wav	Quindi saremo responsabili di orchestrare questi sistemi a un livello di astrazione più elevato.
412	ted_6_6.wav	Non c'era un solo occhio da trovare in queste acque antiche.
413	ted_6_9.wav	C'era un tempo in cui l'idea stessa di vedere non esisteva.
414	ted_6_12.wav	Quindi per motivi che stiamo appena iniziando a capire, apparvero i trilobiti, i primi organismi capaci di percepire la luce.
415	ted_6_13.wav	Sono i primi abitanti di questa realtà che diamo per scontata.
416	ted_6_14.wav	Primo a scoprire che c'è qualcosa al di fuori di sé stessi, un mondo di molteplici sé.
417	ted_6_15.wav	La capacità di vedere si pensa abbia dato il via all'esplosione cambriana, un periodo in cui una vasta varietà di specie animali è entrata nei registri fossili.
418	ted_6_16.wav	Ciò che iniziò come un'esperienza passiva, il semplice atto di far entrare la luce, presto divenne molto più attivo.
419	ted_6_20.wav	La comprensione ha portato ad azioni, e tutte queste portano all'intelligenza.
420	ted_6_21.wav	Oggi non siamo più soddisfatti solo del dono naturale dell'intelligenza visiva.
421	ted_6_22.wav	La curiosità ci spinge a creare macchine per vedere con intelligenza almeno pari, se non migliore.
422	ted_6_23.wav	Nove anni fa, su questo palco, ho presentato una relazione preliminare sui progressi della visione artificiale, un sotto-campo dell'intelligenza artificiale.
423	ted_6_25.wav	Una famiglia di algoritmi chiamata rete neurale, hardware specializzato e veloce chiamato unità di elaborazione grafica, o GPU, e grandi quantità di dati, come i 15 milioni di immagini che il mio laboratorio ha impiegato anni a curare, chiamato ImageNet.
424	ted_6_28.wav	All'epoca, semplicemente mettere etichette sulle immagini rappresentava una grande innovazione.
425	ted_6_29.wav	Ma la velocità e l'accuratezza di questi algoritmi sono migliorate rapidamente.
426	ted_6_30.wav	La sfida annuale ImageNet condotta dal mio laboratorio ha valutato le prestazioni di questo progresso e su questo grafico, stai osservando il miglioramento annuale e i modelli di pietra miliare.
427	ted_6_31.wav	Siamo andati un passo oltre e abbiamo creato algoritmi che possono segmentare oggetti o predire le relazioni dinamiche tra di essi in questi lavori realizzati dai miei studenti e collaboratori.
428	ted_6_33.wav	Ricorda l'ultima volta che ti ho mostrato il primo algoritmo di computer vision in grado di descrivere una foto in linguaggio naturale umano.
429	ted_6_34.wav	Quel lavoro è stato fatto con il mio brillante ex studente, Andrej Kapathy.
430	ted_6_35.wav	"In quel momento, ho rischiato e detto: ""Andrej, possiamo fare in modo che i computer facciano l'opposto?"""
431	ted_6_36.wav	Beh, come puoi vedere da questo post recente, l'impossibile è diventato possibile.
432	ted_6_37.wav	Molti di voi hanno visto i recenti impressionanti risultati di Sora di OpenAI.
433	ted_6_38.wav	Ma anche senza l'enorme numero di GPU, i miei studenti e i nostri collaboratori hanno sviluppato un modello video generativo chiamato WALT mesi prima di Sora.
434	ted_6_41.wav	Significa, guarda quell'occhio di gatto e il modo in cui passa sotto l'onda senza mai bagnarsi.
435	ted_6_42.wav	Se supera il prologo, impareremo da questi errori e creeremo un futuro che immaginiamo.
436	ted_6_43.wav	E in questo futuro, vogliamo che l'IA faccia tutto ciò che può per noi o ci aiuti.
437	ted_6_44.wav	Da anni dico che scattare una foto non è la stessa cosa che vedere e capire.
438	ted_6_48.wav	Quando agiamo su questo mondo nello spazio tridimensionale e nel tempo, impariamo a vedere e fare meglio.
439	ted_6_49.wav	La natura ha creato questo ciclo virtuoso di vedere e fare, alimentato dall'intelligenza spaziale.
440	ted_6_50.wav	Per illustrarti cosa fa costantemente la tua intelligenza spaziale, guarda questa immagine.
441	ted_6_51.wav	Alza la mano se ti senti come se volessi fare qualcosa.
442	ted_6_52.wav	Nell'ultimo frazionamento di un secondo, il tuo cervello ha esaminato la geometria di questo bicchiere, il suo posizionamento nello spazio tridimensionale, il suo rapporto con il tavolo, il gatto e tutto il resto, e puoi prevedere cosa succederà dopo.
443	ted_6_53.wav	L'impulso ad agire è innato in tutti gli esseri dotati di intelligenza spaziale, che collega la percezione all'azione.
444	ted_6_54.wav	E se vogliamo far progredire l'IA oltre le sue attuali capacità, vogliamo più di un'IA che sa vedere e parlare.
445	ted_6_57.wav	I recenti progressi nell'intelligenza spaziale consistono nell'insegnare ai computer a vedere, imparare, fare, e imparare a vedere e fare meglio.
446	ted_6_59.wav	Ci sono voluti milioni di anni alla natura per evolvere l'intelligenza spaziale, che dipende dal fatto che l'occhio cattura la luce, proietta immagini bidimensionali sulla retina e il cervello traduce questi dati in informazioni tridimensionali.
447	ted_6_60.wav	Solo di recente, un gruppo di ricercatori di Google è riuscito a sviluppare un algoritmo in grado di prendere un insieme di foto e tradurlo nello spazio tridimensionale, come gli esempi che stiamo mostrando qui.
448	ted_6_61.wav	Il mio studente e i nostri collaboratori hanno compiuto un passo ulteriore e creato un algoritmo che prende un'immagine in input e la trasforma in una forma tridimensionale.
449	ted_6_63.wav	Ricorda che abbiamo parlato dei programmi informatici che possono prendere una frase umana e trasformarla in video.
450	ted_6_64.wav	Un gruppo di ricercatori dell'Università del Michigan ha scoperto un modo per tradurre quella riga di frase in un layout tridimensionale della stanza, come mostrato qui.
451	ted_6_65.wav	E i miei colleghi a Stanford e i loro studenti hanno sviluppato un algoritmo che prende un'immagine e genera spazi infinitamente plausibili per gli osservatori da esplorare.
452	ted_6_66.wav	Questi sono prototipi della prima scienza nascente di una possibilità futura, in cui la razza umana può prendere tutto il nostro mondo e tradurlo in forme digitali e modellare la ricchezza e le sfumature.
453	ted_6_67.wav	Quello che la natura ha fatto implicitamente per noi nelle nostre menti individuali, la tecnologia dell'intelligenza spaziale può sperare di fare per la nostra coscienza collettiva.
454	ted_6_68.wav	Poiché il progresso dell'intelligenza spaziale si accelera, sta prendendo luogo davanti ai nostri occhi una nuova era in questo ciclo virtuale.
455	ted_6_69.wav	Questo andirivieni sta catalizzando l'apprendimento robotico, un componente chiave per qualsiasi sistema di intelligenza incorporata che deve comprendere e interagire con il mondo tridimensionale.
456	ted_6_70.wav	Oggi, stiamo facendo lo stesso con comportamenti e azioni per addestrare computer e robot su come agire nel mondo tridimensionale.
457	ted_6_71.wav	Ma invece di raccogliere immagini statiche, sviluppiamo ambienti di simulazione basati su modelli spaziali in 3D, in modo che i computer possano avere infinite possibilità di imparare ad agire.
458	ted_6_72.wav	E stai vedendo solo un piccolo numero di esempi per insegnare ai nostri robot in un progetto guidato dal mio laboratorio chiamato Behavior.
459	ted_6_74.wav	Tipicamente, mi piacerebbe un po' di più per il mio panino, ma questo è un buon inizio.
460	ted_6_75.wav	In quell'oceano primordiale nei tempi antichi, la capacità di vedere e percepire il proprio ambiente ha dato il via alla esplosione cambriana di interazioni con altre forme di vita.
461	ted_6_77.wav	L'intelligenza spaziale sta permettendo alle macchine di interagire non solo tra loro, ma anche con gli esseri umani e con mondi tridimensionali, reali o virtuali.
462	ted_6_78.wav	E poiché quel futuro si sta delineando, avrà un impatto profondo su molte vite.
463	ted_6_80.wav	Per l'ultima decade, il mio laboratorio ha compiuto alcuni dei primi passi nell'applicare l'Intelligenza Artificiale per affrontare sfide che influenzano l'esito dei pazienti e il burnout del personale medico.
464	ted_6_81.wav	Insieme ai nostri collaboratori della Scuola di Medicina di Stanford e agli ospedali partner, stiamo testando sensori intelligenti che possono rilevare i clinici che entrano nelle stanze dei pazienti senza lavarsi correttamente le mani, tenere traccia degli strumenti chirurgici o avvisare i team di assistenza quando un paziente è a rischio fisico, come nel caso di una caduta.
465	ted_6_82.wav	Consideriamo queste tecniche una forma di intelligenza ambientale, come paia di occhi extra che fanno la differenza.
466	ted_6_83.wav	Ma vorrei un'assistenza più interattiva per i nostri pazienti, clinici e assistenti che hanno disperatamente bisogno anche di un aiuto in più.
467	ted_6_84.wav	Immagina robot autonomi che trasportano forniture mediche mentre i caregiver si concentrano sui nostri pazienti, o la realtà aumentata che guida i chirurghi per effettuare operazioni più sicure, più veloci e meno invasive.
468	ted_6_85.wav	Oppure immagina pazienti con paralisi grave che controllano robot con i loro pensieri, esatto, onde cerebrali, per svolgere attività quotidiane che tu e io diamo per scontate.
469	ted_6_86.wav	Stai vedendo un'anteprima di quel futuro in questo studio pilota del mio laboratorio di recente.
470	ted_6_87.wav	Questo studio, pubblicato alcuni anni fa, ha ribaltato un mondo di oscurità.
471	ted_6_88.wav	Ha dato inizio al processo evolutivo più profondo, lo sviluppo dell'intelligenza nel mondo animale.
472	ted_6_89.wav	Il progresso mozzafiato dell'IA nell'ultimo decennio è altrettanto sorprendente.
473	ted_6_90.wav	Ma credo che il pieno potenziale di questa esplosione digitale cambriana non sarà completamente realizzato fino a quando non alimentiamo i nostri computer e i nostri robot con intelligenza spaziale, proprio come ha fatto la natura con tutti noi.
474	ted_6_91.wav	È un momento emozionante insegnare al nostro compagno digitale a imparare a ragionare e interagire con questo bellissimo spazio 3D che chiamiamo casa, e anche creare molti altri mondi nuovi che tutti possiamo esplorare.
475	ted_6_93.wav	Richiede a tutti noi di compiere passi ponderati e sviluppare tecnologie che mettano sempre gli esseri umani al centro.
476	ted_6_94.wav	Ma se facciamo tutto nella maniera giusta, i computer e i robot dotati di intelligenza spaziale non saranno solo strumenti utili, ma anche partner fidati per migliorare e potenziare la nostra produttività e umanità, rispettando al contempo la nostra dignità individuale e aumentando la nostra prosperità collettiva.
477	ted_6_95.wav	Ciò che mi entusiasma di più riguardo al futuro è un futuro in cui l'intelligenza artificiale diventa sempre più perspicace, acuta e consapevole dello spazio, e si uniscono a noi nella nostra ricerca di perseguire sempre un modo migliore per creare un mondo migliore.
